ID,Categoria,Requisito,Descripcion,Prioridad
RF-01,Interfaz de Usuario,Visualizacion de peliculas populares,El sistema debe mostrar un listado de peliculas populares en la pagina principal,Alta
RF-02,Interfaz de Usuario,Visualizacion de peliculas mejor valoradas,El sistema debe mostrar un listado de peliculas mejor valoradas,Alta
RF-03,Interfaz de Usuario,Visualizacion de peliculas proximas a estrenarse,El sistema debe mostrar un listado de peliculas que se estrenaran proximamente,Media
RF-04,Interfaz de Usuario,Visualizacion de peliculas en cartelera,El sistema debe mostrar un listado de peliculas actualmente en cartelera,Media
RF-05,Busqueda,Busqueda de peliculas por titulo,El sistema debe permitir al usuario buscar peliculas por titulo,Alta
RF-06,Busqueda,Filtrado de resultados,El sistema debe permitir filtrar los resultados de peliculas por categoria,Media
RF-07,Detalle,Vista detallada de pelicula,El sistema debe mostrar informacion detallada al seleccionar una pelicula especifica,Alta
RF-08,Detalle,Visualizacion de imagenes de la pelicula,El sistema debe mostrar imagenes relacionadas con la pelicula seleccionada,Media
RF-09,Detalle,Visualizacion del reparto de la pelicula,El sistema debe mostrar el reparto principal de la pelicula seleccionada,Media
RF-10,Detalle,Visualizacion de peliculas relacionadas,El sistema debe mostrar peliculas relacionadas o similares a la pelicula seleccionada,Baja
RF-11,Navegacion,Paginacion de resultados,El sistema debe implementar un sistema de paginacion para navegar entre multiples resultados,Alta
RF-12,Navegacion,Navegacion entre categorias,El sistema debe permitir al usuario navegar entre diferentes categorias de peliculas,Alta
RF-13,Integracion API,Consumo de datos de TMDB,El sistema debe consumir datos desde la API de TMDB,Alta
RF-14,Integracion API,Actualizacion de datos en tiempo real,El sistema debe actualizar los datos mostrados en sincronizacion con TMDB,Media
RF-15,Rendimiento,Carga bajo demanda,El sistema debe implementar carga de datos bajo demanda para optimizar el rendimiento,Media
RF-16,Interfaz de Usuario,Diseno responsive,El sistema debe adaptarse a diferentes tamanos de pantalla (movil  tablet escritorio),Alta
RF-17,Interfaz de Usuario,Visualizacion de calificaciones,El sistema debe mostrar calificaciones/puntuaciones de las peliculas,Media
RF-18,Usuarios,Navegacion sin registro,El sistema debe permitir navegar y consultar informacion sin necesidad de registro,Alta
RF-19,Usuarios,Sistema de favoritos,El sistema debe permitir marcar peliculas como favoritas (si implementa autenticacion),Baja
RF-20,Rendimiento,Cache de datos,El sistema debe implementar cache de datos para reducir llamadas a la API,Media